product_id,department_id,subdepartment_id,supplier_id,product_name,price,product_description
54,5,1,5,ATOPolyjet Remanufactured Ink Cartridge Replacement for HP 60 XL 60XL Black Color Fit for PhotoSmart C4680 C4780 C4795 D110a DeskJet F4480 D2530 F4280 F4580 F2430 D2660 Envy 120 100 110 114 Printer,29.99,"High Yield: 660 Pages per 60XL Black Ink Cartridge , 450 Pages per 60XL Color Ink Cartridge at 5% coverage
Package Contents: 1 Black + 1 Tri-Color Remanufactured Ink Cartridge Replacement for HP Ink Cartridge 60. All ATOPolyjet remanufactured 60XL Ink Cartridge Combo Pack Color and Black adopt premium ink, which have been tested to ensure full working condition and a superb quality prints."
55,5,1,5,Night Light Projector Gifts for Kids: DEVRNEZ 360 Degree Rotating Moon Star Nightlight for Age 2-12 Baby Girls Boys for Bedroom Christmas Stocking Stuffers|Party and Birthday Toys Gifts (Black),12.96,"-Christmas Star Moon Night Lights Projector: DEVRNEZ night lamp is wonderful, bringing kids into a vast universe to appreciate the colorful moon and stars flying around the rooms. Funny enjoy the sky, satisfy their curiosity of universe and cultivate unlimited imagination.
-8 Colors Changing Modes: More colourful color changing with built-in 4 upgraded Led lamp beads and have last long lifetime. 360 degree rotatable, provides a fantastic moving starry sky.
-Baby Nursery Sleeping Lights: Covered with a dome cover, the starlight projector can be used as a nightlight that emits a soft warm white light and working without noise and glaring. Drive away the darkness of kids' room and coax the baby to fall into a deep sleep quickly.
-2 Power Ways and Child-safe: The kid night lights can be powered by 4 x AAA battery (Not Included) or USB cable. But the 2 power ways can't use at the same time. Our baby night light is made of non-toxic material, kids can take it anywhere which can provide the warm light for kids to walk through the hallway to bathroom and go back to bedroom.
-Ideal Gifts for Kids: Great Christmas gifts stocking fillers for boys and girls babies on birthday, Christmas, and Children's Day. The 360-degree rotating star lighting lamp is also an ideal decoration for birthday parties, festival celebrations, and so on, helping to create a warm and romantic atmosphere."
56,2,4,10,"PG Tips Pyramid Bags, Premium Black Tea, 80 ct",9.99,"-PG tips is England's No. 1 Tea
-The eighth wonder of the world pyramid bag acts like a mini teapot, giving the tea leaves room to move so you can get even more out of the great PG tips flavor.
-PG tips Black Tea Pyramid Tea Bags feature a popular British blend of the finest Assam, Ceylon and Kenyan teas which produces a rich and refreshing flavor.
-PG tips pyramid bags are fully Rainforest Alliance Certified, so when you choose PG Tips, you're helping us help the environment, tea farmers, and their families.
-How to brew: 1 bag per cup, add freshly boiled water, and brew 1 to 3 minutes to your desired strength."
57,2,4,10,Lipton Tea Bags For A Naturally Smooth Taste Black Tea Iced or Hot Tea ,12.17,"-Lipton Black Tea Bags can help support a healthy heart.
-Our Lipton Black Tea pack contains 400 tea bags that come as 2 boxes of 200 tea bags.
-All our tea leaves are picked at the peak of freshness for a naturally smooth taste.
-Lipton Black Tea is sustainably sourced, made with only 100% Rainforest Alliance certified tea bags.
-Get the best from your brew in 2 minutes, adding the tea bag first then water, so the leaves can unleash their flavor. Brew as a hot tea or pour over ice for a refreshing iced tea beverage.
-With 55 mg per 8-ounce serving, Lipton Black Tea contains 60% less caffeine than coffee."
58,2,4,10,"Lipton Iced Tea Mix for a delicious refreshment Peach Sweetened with Real Cane Sugar 100% Real Tea Leaves 100% Sustainable Sourced 10 qt, 23.6 Oz(6 Pack)",22.89,"-Made with the sweet flavor of peaches, this tea has the delicious taste of summer in every glass.
-Pack of six 10-quart cans.
-100% natural, no added preservatives and colorings.
-Thirst-quenching and delicious, this iced tea mix is brewed from real tea leaves.
-Combine iced tea mix as per your taste with 8 fl oz water and get instant refreshment any time."
59,2,4,10,Tea4U Peach Black Iced Tea Bags - Hot & Cold Brewed,10.75,"ENVIRONMENTALLY CONSCIOUS – Sustainably produced with strict adherence to environmental standards, Tea4U is committed to ensuring that all of the tea we use is sustainably and ethically produced from the best tea-growers in Sri Lanka. Social and environmental wellbeing is crucial to the ethos of the Tea4U brand. Each environmentally conscious, staple-free teabag, individually sealed in an foil envelop to ensure freshness. | 12g x 10 TB = 120g Net| Tea4U
PERFECT BREW – Tea4U teabags are designed to make brewing the perfect iced tea simple and convenient. The rich flavors readily infuse to create a fragrant and distinctive brew.
TRUSTED HERITAGE - Produced by Trusted Ceylon Tea Exporters ANVERALLY & SONS. Exporters Since 1892
ECONOMICAL – Each teabag produces a half-gallon of perfectly brewed iced tea. This means each box of ten ½ oz. tea filter bags yields 5 gallons of brewed iced tea, making this an economical option for iced tea lovers everywhere."
60,2,4,10,"Pure Leaf, Organic Iced Tea, Sicilian Lemon & Honeysuckle, 14oz Bottles (Pack of 8) (Packaging May Vary)",17.42,"Premium USDA certified organic tea leaves
Brewed organic black tea, organic cane sugar, citric acid, natural flavor, brewed organic lemon peel
No artificial sweeteners or added color
Sicilian Lemon & Honeysuckle flavor; Only 90 calories per bottle
14 ounce glass bottles, 8 count"
61,2,4,10,"GENKI FOREST R Tea Peach Oolong Tea, 0 Sugar, Made From Freshly Brewed Tea, Natural Antioxidants, 16.9 fl oz(Pack of 15)",35.98,"-OOLONG TEA BENEFIT: Oolong is a delicate semi-oxidized tea abundant with natural antioxidants, unique from green and black teas. It is considered beneficial for general health and well-being.
-OUR ARTISAN SPIRIT & CRAFTSMANSHIP: The most peachy flavor in our tea family, this Peach Oolong Tea is brewed with premium Anxi Huangjingui. Enjoy a fruity hint of peach that perfectly complements the tea's mild, smooth, and slightly sweet taste. We only bottle tea from the first brew to retain the highest quality, so that it is as fresh as just brewed when you open it.
-REFRESHINGLY SWEET & SUGAR-FREE: Energize and hydrate anytime with a more flavorful taste experience than water. Sugar-free, guilt-free, still refreshingly sweet, and smooth.
-DIETARY FIBER & ANTIOXIDANTS: Each bottle contains up to 200mg of tea polyphenols and 8000mg of dietary fiber, high in Vitamin C.
-TASTE WANDERLUST: Discover unexpected flavor that shines --a refreshing twist on 4 global-inspired flavors of oolong tea that take you on a journey in taste.
Includes a pack of 15 bottles of 16.9 oz Peach Oolong tea."
62,6,1,12,"PatioFestival Patio Dining Set 5 Pieces Outdoor Furniture Sets 50,000 BTU Square Propane Fire Pit Table with Swivel Rocker Dining Chairs(Grey)",1059.6,"360 DEGREE SWIVEL CHAIRS: Swivel function provides extra comfort and relaxation. These patio dining chairs perform a smooth 360-degree spin and slight rocking motion while you enjoy your meal. Set the mood with comfortable and relax seating for your patio. Attached to the swivel seat frame, the chair arms are heat-resistant, wear-resistant, and provide increased rocking comfort when lounging and relaxing. Each chair seat supports up to 300 pounds.
➤COMFORT TEXTILENE FABRIC: Patio dining chairs with excellent textilene fabric,which is comfortable to sit and fits your body line perfectly.You will like the touch and comfort.Curved arms and well ventilated seat won't make you feel ache or sweat after long-time sitting,suitable for use all over the year. The extra thickened steel frame ensures its durability for years to come. In additional, an extra metal crossbar is added under the chair for a sturdier frame and better weight capacity.
➤MULTI-FUNCTION FIRE PIT TABLE: 50,000 BTU fire table can keeps you warm without smoke on many wonderful night. The flame level and heat output is adjustable by using the control knob. (Flame height from 1-9"" approximately). There's enough room on the sides for drinks and small plates. Fuel type: 20 lb propane tank.(Not included). Propane is easier to ignite than wood or charcoal. The side door can come off with ease. Included top lid can converts this into a outdoor dining table.
➤ALL-WEATHER MATERIAL: Patio chairs and table set is crafted with a galvanized steel frame.This weather resistant patio dining set is designed to be rust-resistant and long-lasting. Breathable textilene fabric filled with sponges, padded chairs will bring you ultimate seating comfort. Tabletop uses thermal transfer technology. The wood look of tabletop can last for years which are made of metal material.
➤SAFE PATIO FURNITURE SET: Whether for enjoying a outdoor bonfire party in patio or sit back and enjoy the dancing flames in poolside,this patio dining set compliments any outdoor space. This all weather table and chairs set includes a 50,000 BTU square fire table and 4 padded outdoor chairs. Cups and other decorations are not included. CSA Certification fire table provides you a safe and green burning,creating a warm and romantic bonfire atmosphere. No smoke when burning. Lava Rocks included."
63,6,1,12,"Sophia & William Patio Dining Set 7 Pieces Outdoor Metal Furniture Set, 6 x Swivel Dining Chairs with 1 x 6 Person Wood Like Umbrella Table for Outdoor Lawn Garden",1299.99,"-Weather-Resistant: Our metal table and chair furniture set made of sturdy metal steel frame with powder coating, rust resistant, easy to clean, no special care
-Comfortable Design: Smooth 360 degree swivel chair with high density spun polyester cushion, stylish wood like table design will brings aesthetic feeling to your patio, lawn, garden.
-Outdoor & Indoor Occasion: Our dining sets is not only suitable for outdoor garden lawn patio pool coffee time but also suitable for indoor kitchen living room dinner time.
-Dimension: large umbrella table 6 person table L61.42"" x W37.8"" x H28.94"", swivel chair: seat height 15.5"", seat width 20"".
You may receive 4 packages on different days. Comes with 1 dining table, 6 dining swivel chairs in 3 packages. If you have any problems with your order, please contact us, we'll help you solve it We back our products with a manufacturers warranty against defective workmanship or parts missing."
64,6,1,12,"Christopher Knight Home 315046 Azalea Outdoor Dining Sets, Black + Teak",777.76,"-TRANSITIONAL: The transitional style of this dining set is sure to give your outdoor space a minimalistic yet classic look that will match seamlessly with any arrangement you currently have. With a simple yet outstanding mix of materials, this set will give your backyard an instant upgrade in style and comfort.
-ACACIA WOOD TABLETOP: Made with acacia wood that brings a sleek and exotic look to your space, this durable hardwood naturally withstands outdoor elements and will not darken over time. Acacia wood is perfect as a solid, heavy frame that resists wear and tear.
-SLAT DESIGN: The top of the table features beautiful slat paneling, giving this piece a sophisticated, classic look. This perfectly complements the modern yet traditional look of this set, giving this set a wonderfully cohesive feel to your decor.
-POLYPROPYLENE RESIN SEATING: Created with high-quality, specially designed polypropylene, our chairs are made to be highly durable and weather-resistant. Each individual component of our polypropylene blend is specifically chosen to create a unique mixture that ensures that your product is of the best quality.
-DIMENSIONS: Choose an accessory that is the perfect size for you and your furniture. Each chair is 23.00” W x 21.50” D x 33.00” H and the table is 59.25” W x 35.50” D x 30.00” H. You will love how much your space can transform with the simple addition of this charming dining set. This set includes six chairs and one dining table.
Ships in several boxes, may ship separately
"
65,6,1,12,Flash Furniture 28'' Square Glass Metal Table with Dark Brown Rattan Edging and 2 Dark Brown Rattan Stack Chairs,174.47,"-Make the most of bright sunny days and laid back sultry evenings when you have this comfortable table and chair set. Perfect for a home patio, poolside or the courtyard at your restaurant or cafe, this is a definite outdoor upgrade
-Square table with 5mm thick glass, clear tempered glass surface, 1.375"" edge top with decorative rattan edge band
-Lightweight design café chair, curved rattan seat and back, stacks 23 high, holds up to 352 lb. weight capacity
-Contemporary glass and metal table and chair set for commercial and residential use
PRODUCT MEASUREMENTS >>> Table Size: 28""W x 28""D x 28""H | Base Size: 25.5""W | Chair Size: 21.75""W x 23.5""D x 28.5""H | Back Size: 11.5""W x 13.5""H | Seat Size: 16.5""W x 15""D x 17""H
-Ships in several boxes, may ship separately.
"
66,6,1,12,"Incbruce 7Pcs Outdoor Patio Furniture Conversation Sets (Loveseat, Coffee Table and Bistro Table, 2 Spring Chair, 2 Lounge Chairs) - Steel Frame Cafe Furniture Sets with Cushions (Peacock Blue)",599.99,"MATERIAL: Powder coated stable steel frame, rust and weather resistant. Extra-padded cushions for superior comfort when sitting. Solid and stable metal table with beauty honey comb top.
FUNCTION: This conversation set is stylish and perfect for any outdoor space including yards, patios, gardens, porches or indoors if you want. You can eat, play games or bask in the sun with your friends.
FEATURES: Curved arms and an extra wide seat with padded cushion provide a high quality user experience. The unique back design not only makes the seating sturdier. The padded cushions are well-made. Padded cushions with removable covers allow for easy cleaning and maintenance
Product Dimension: Loveseat 47.24” (L)x 29.53” (w) x 33.85” (H); Coffee Table 35.8” (L)x19.68” (w) x 18.5” (H); Bistro Table: 20""(D) x 17.7""(H); Spring Chairs: 29"" (L) x 25.2"" (w) x 34.24""(H); Lounge Chair 29.53” (L)x 25.11” (w) x 33.86” (H); Cushion:3.9” thick.
Easy to Assemble: Follow the instruction, easy and quick assembly. Includes all hardware & necessary tools. If you have any questions, please feel free to contact us and our customer service team will respond within 24 hours to assist you."
67,3,1,3,"Googipet 10 in 1 Dog Multivitamin with Glucosamine & PurforMSM for dog hip and joint support - Essential Dog Vitamins w/ Chondroitin, Probiotics & Omega Fish Oil -One dog supplement for overall health",24.99,"10 Benefits In 1 Daily Treat – Googipet’S 10-In-1 Multivitamin Treats Combine The Most Essential Vitamins And Supplements Including Glucosamine, Probiotics, Vitamins And Omegas, For Dogs’ Overall Daily Health. More Energy And Less Health Problems! For Big Dogs, Medium Sized Dogs, And Small Dogs!
Joint Health With Glucosamine - Our All-Natural Soft Chew Supplement Treats Have High Amounts Of Glucosamine, Purformsm And Other Proven Joint Support Ingredients That Reduce Joint Inflammation And Increase Mobility And Flexibility.
Improve Digestion With 1 Billion Cfu Probiotics - These One A Day Dog Vitamins Contain Probiotics, Pumpkin And Vitamins That Help Keep Your Dog’S Digestive System Running Smoothly And Decrease Diarrhea, Vomiting And Stomach Issues.
Healthy Skin + Coat With Omegas - Egg Shell Meal And Omegas From Krill Oil And Flaxseed Heal Dry, Itchy And Flaky Skin And Increase Coat Strength, Shine And Overall Health.
Immune System + Heart Health With Vitamins A, C And D3 - A Blend Of Vitamins With Anti-Inflammatory And Antioxidant Properties Improves Immune System And Keeps Heart Strong And Healthy. Your Dog Will Love Our Chew Taste, Making It Easy For You To Improve Your Dog’s Overall Health."
68,3,1,3,"VetPro Dog Vitamins and Supplements - Pet Multivitamins with Probiotics, Glucosamine for Hip and Joint Health, Immune System Support, Allergy Meds - 5 in 1 Chewable Multivitamin for Puppy to Senior",29.95,"VETERINARIAN FORMULATED - Our dog vitamins and supplements focus on five key areas. Dog probiotics for digestive function, dog skin and coat supplement, joint mobility, heart health and enhanced immunity. Formulated by a vet with over 30 years of experience, our multivitamins for dogs are a nutritional dog supplement to promote ideal functioning and longevity. VetPro's essential dog health supplies improve your pet's overall health and well-being. Ideal puppy vitamins and senior dog vitamins.
PROMOTES OPTIMAL DIGESTIVE FUNCTIONING - Our dog probiotic supplement is specially formulated to prevent diarrhea, loss of appetite, constipation, gas, and bloating. Superior digestive health begins with the optimal blend of ingredients in our dog supplements with 500 million CFU per chew.
KEEP YOUR DOG ACTIVE - Our proprietary vitamins for dogs are not high calorie dog supplements. They are supplements with active ingredients that every pet needs for hip and joint health. With powerful ingredients like Glucosamin HCL, Chondroitin, MSM, and Turmeric, our multivitamin targets inflammation which can cause pain and interfere with an active lifestyle.
A BEAUTIFUL COAT IS A HEALTHY COAT - Each tasty chew includes fish oil and Vitamin E to help reduce itching, allergies, and dry skin. Promote a silky, smooth coat and reduce skin irritation with our enriched formula designed to help your best friend look and feel great.
SUPERIOR INGREDIENTS FOR LONGEVITY - Our multivitamin chews include powerful Omega-3, natural antioxidants, and key vitamins to help promote a strong healthy heart and cardiovascular system. Vitamins A, B, C, and E will boost your pup's immune system. Your pet's health is your responsibility, so provide them with only the best."
69,3,1,3,"PetHonesty 100% Natural Omega-3 Fish Oil for Dogs from Iceland - Omega-3 for Dogs - Pet Liquid Food Supplement- EPA + DHA Fatty Acids Reduce Shedding & Itching- Supports Joints, Brain & Heart Health",25.99,"Made With Wild-Caught Fish From Iceland - PetHonesty's Omega-3 Fish Oil is made with sardines, mackerel, anchovies and herrings, caught in the pure and clean waters off the coast of Iceland. These fish are high in Omega-3s but low in mercury and toxins and will help support your dog's joint, heart, immune system, skin, coat and overall health.
Naturally Purified To Remove 99.9% Of Fishy Taste + Smell - Your dogs will love the taste of our 100% natural Omega-3 Fish Oil mixed right into their food. And you'll love that it has hardly any fishy smell! Our Omega-3 Fish Oil is naturally purified to remove the fishy odor and taste found in most fish and salmon oils for dogs. We use a 3rd Party tester to ensure potency and purity of our product and bottle our oils in a GMP certified facility in the U.S.A.
Maintain A Healthy + Glossy Coat: The high amounts of DHA, EPA and other Omega-3 fatty acids found in this 100% Natural Fish Oil for dogs will promote healthy skin and a glossy coat in your dog. One serving of our Omega-3 oil contains 800mg of EPA and 525mg of DHA that also supports the immune system
Support Immune System + Proper Joint Nutrition: The Omega-3's supplied by PetHonesty's Omega-3 Fish Oil will not only promote healthy skin and coat but also help support a healthy immune response and normal inflammatory response in your dog's body. This supports overall health and wellbeing for your dog.
Vet-recommended As A Healthy Source Of Omegas: PetHonesty's Omega-3 Fish Oil has been reviewed and recommended by veterinarians as a healthy source of omegas to help support healthy joints, cardiovascluar health, immune system and skin/coat."
70,3,1,3,Christmas Dog Bandanas Triangle Dog Scarf Adjustable Washable for Christmas Pet Costume Supply,8.99,"Fit to most pets: The pet's bandana is triangular, size is 27.6""*18.9""*18.9"", perfect for small to large dogs, such as Labrador, Boxer, Doberman, German Shepard, etc. animals like dog, cat, rabbit, alpaca are suitable for this bib.
The bandanas have cute print, you can found Christmas elements, such as santa claus,snowman etc, it’s can be a very cute gifts for dog in Christmas.
High quality fabric: made of carefully selected polyester fabric with bright color and soft touch, it will gently care for your dog's skin and hair. Ventilation and comfort, will not let the dog feel uncomfortable, and solve the dog's saliva problem.
Wide scope of application: washable cat scarf with beautiful design is applicable in occasions like , birthday party and Christmas; Apart from being ornament to decorate your pets, what the scarf performs better is to collect the saliva made by pets, helping to clean their mouth.
Best gift: surprise your pet before Christmas. When you take your dog out to buy some candy, everyone will pay attention to your charming baby dog."
71,3,1,3,K9 Sport Sack Knavigate | Dog Carrier Dog Backpack for Most Dog Sizes | Front Facing Adjustable Dog Backpack Carrier | Veterinarian Approved,174.95,"THE MEDIUM K9 SPORT SACK KNAVIGATE will fit dogs with the length of 17-20 inches and have a girth up to 28 inches. Typical dog breeds that will fit this size backpack include Jack Russel Terrier, Lhasa Apso, Pug, Havanese and Schipperke. Use it as a dog travel bag for hiking, bikes, subways, shopping, motorcycles, skiing, dancing..heck the possibilities are endless!
KNAVIGATE BACKPACK: Do you hate seeing big, sad puppy dogs eyes as you walk out the door for an adventure, leaving your best friend behind? Our trainer dog sports backpack are ideal for owners who want to take their pups with them, but are looking for an economical solution. Our backpack carrier are great for dogs who suffer from anxiety, depression, or have a physical disability. Our pet backpack are also great for older dogs or puppys that may not have the stamina for your next big adventure.
ROUND TALL FAT SMALL: We get it! Dogs come in all shapes and sizes, and not every pet travel bag fits the same. We have your dog covered! Our dog travel carrier is available in multiple sizes from X-Small to X-Large. We have a dog carrier bag that will fit almost any dog breed. View the product images to the left to find the right size for your dog! Please contact us and visit our website for more accurate sizing recommendations.
SPORT SACK IS THE NEW BLACK: (Tip) For all the chubby dogs out there with a few fat rolls over the collar, our Midnight Black dog hiking backpack is very slimming! Jokes aside, Midnight Black is 1 of the 2 stylish colors we offer in the Sport Sack KNAVIGATE, and don’t worry all the colors have a slimming effect! Our dog carrying backpack is designed to keep your dog safe and secure. Its the ultimate dog backpack for hiking!
USA-BASED COMPANY, PERFORMANCE GUARANTEED: Wrong size? No problem. Any issues? We’re here for you. Whatever the problem may be don’t worry we’ll cover it, but we’re happy to hear any good stories and see your adventures with your dog. This puppy backpack is backed by a 60-Day Quality Guarantee. Must be sold by seller ""K9 Sport Sack"" or warranty is voided."
72,6,1,12,"Thirstystone Brand - Desert Sand Coaster, Multicolor All Natural Sandstone - Durable Stone with Varying Patterns, Every Coaster Is An Original 4 inch round",14.21,"All natural sandstone - these Thirstystone coasters are made from natural sandstone, with an organic design derived from natural stone formations. Every coaster has a varying pattern and adds a stunning piece of decor to any room.
4"" Round - these natural stone coasters are four inches in diameter and one half inch thick. Fit perfectly in a Thirsty stone pedestal coaster holder.
Protective - tired of drips on your kitchen counter or water rings on your coffee table? Use these Thirsty stone coasters to protect in every room of the house. Dining Table, kitchen, bedroom night stands, Coffee table or living room end tables, These coasters are great for anywhere!
No scratch - our Thirstystone all Natural sandstone coasters have a natural cork backing to protect any surface from scratches or scuffs and keep the coaster from sliding.
Care - Since these coasters are made from true stone, please gently hand wash with soap and water, then let completely dry. Please let coaster Dry between uses.
Genuine Thirsty stone - Don't be fooled by other coasters that try to imitate Thirsty stone's quality and look, make sure you get real Thirsty stone branded sandstone coasters!"
73,7,4,13,"Pantene Sulfate Free Shampoo and Conditioner plus Hair Mask Shot Treatment with Rose Water, Nutrient Blends Miracle Moisture Boost",12.55,"-Rose water shampoo that gives soothing hydration for thirsty hair. You will receive 1 9.6 oz bottle of shampoo, 1 8 oz bottle of conditioner and 1 0.5 oz Hair Mask shot.
-Nourishing conditioner helps seal in moisture for silky softness.
-Hair Mask shot: dry hair moisturizing treatment noticeably repairs extreme damage in 1 use.
-Color-safe formula that’s safe for chemically treated hair."
