product_id,department_id,subdepartment_id,supplier_id,product_name,price,product_description
74,6,3,12,"Tertill Garden Weeding Robot - Prevents Weeds in Vegetable Gardens, Solar-Powered, Makes a Great Gift",296.95,"EASY TO USE – Place Tertill in any garden that meets the requirements, press the button once to wake it up, and again to make it go. From the inventor of Roomba.
GARDEN REQUIREMENTS – 4-inch (or higher) border, a foot between plants or rows, a relatively flat (slope of less than 7 degrees), and relatively smooth surface. Place Tertill in a weed-free garden to start. Each robot can maintain up to 200 sq. ft.
PLANTS vs WEEDS – Tertill uses height to identify plants from weeds. Anything tall enough to touch its front sensors is considered a plant and Tertill will turn away. If it passes under the robot, Tertill cuts it. Included plant guards protect desired seedlings not tall enough to be detected by the robot.
STAYS in the GARDEN– Tertill never goes on vacation or has something better to do. It is weatherproof and can stay in the garden from Spring through Fall. Solar-powered, it never needs to be charged!
GREAT GIFT – Perfect for busy moms, dads, grandparents or anyone who doesn't have the time, ability or desire to weed the garden, but still wants to grow fresh healthy vegetables for their family.
FREE APP & SUPPORT – Free smartphone app lets you monitor your robot and upgrade software. Free customer service at Support@Tertill.com. 1-Year Warranty.
NOT FOR LAWNS or SLOPED AREAS"
75,6,3,12,"Expandable Garden Hose, Lightweight Retractable Water Hose, With 10 Functions Nozzle, With Soap Bottle, 3 Times Expanding, Kink Free, With 3/4 Inch Solid Brass Fittings And Double Latex Core",45.99,"1. 【Lightweight and Portable】: The flexible hose are light in weight, and the quality is also very good, which feels very handy to use. Equipped with storage bags and hooks, which is convenient to store and does not take up too much space. When water is turned on, the expanding water hose can be extended to three times its original length, enough to extend to any place in the yard, and it is not easy to kink.
2. 【Nozzles with 10 Functions】: Rotate the baffle to choose the nozzle type you need: Full, Flat, Shower, Cone, Jet, Soaker, Angle, Mist, One Half Vertical and Center. The nozzle is easy to hold, ergonomically adequate, The squeeze handle design is much better than the thumb adjustment design, it also has a Hold switch mechanism, so you don’t need to keep it hard.
3. 【Equipped with a Soap Bottle】: Compared with other garden hoses on the market, we also have a bottle for detergent. Introduce detergent into it, then use it with the spray gun, which can produce rich foam, you don't need to have a separate bucket of soapy water anymore. Adjust the amount of foam with the rotary switch, makes it easy for you to clean your car and bathe your pet.
4. 【High-quality Parts】: The material of the joint is solid brass. The heavy duty hose uses a double latex core and 3750D polyester fabric cover to prevent breakage and leakage. It can withstand water pressures of 4 to 8 Bar, and withstand temperatures between 14 degrees Fahrenheit and 176 degrees Fahrenheit. Even in winter, there is no need to worry about leaks, tears or breaks in water pipes.
5. 【Wide Range of Uses】: This garden hose is suitable for all your outdoor watering needs, including car, house, floor, yard washing, garden watering, and even pet cleaning."
76,7,3,9,"Juicy Couture Viva La Juicy Noir Eau de Parfum Spray, Perfume for Women, 3.4 oz",72,The daring aura of noir will lure you in with adventurous fruit flavors and sultry sandalwood.
77,7,3,9,"Tom Ford 'Oud Wood' Eau de Parfum 3.4,Black",332.01,"Tom Ford Private Blend Oud Wood Eau De Parfum Spray - 100ml/3.4oz
An oriental woody fragrance for men & women War
Tom Ford"
78,4,3,4,"Paperage 3 Pack Lined Journal Notebook, Bulk Classic Hardcover, 5.7 x 8 inches, 100 gsm Thick Paper for Office Home School Business Note Pads(Black, Ruled)",19.95,"HARDCOVER JOURNAL: 3 notebooks sized medium 5.7 X 8 inches. These are a best seller with a simple design and timeless style. They features a durable and water-resistant vegan leather cover, inner expandable pocket, rounded corners, 160 pages, ribbon bookmark, and an elastic closure band. The medium size makes it the perfect choice for all your journaling or note taking needs.
GREAT VALUE WITH A MULTI-PACK: Our value packs of 3 notebooks are a great way to stock up for all your journaling and note taking needs. With a multi-pack you'll never run out and always have an extra on hand for the home, at the office, and for school - a convenient option for on-the-go students or busy professionals!
PREMIUM PAPER: Our journal paper is made with quality, 100 gsm, acid-free paper so you never have to fear your favorite pen, marker, or pencil will bleed ink or disappear. Your journaling and notes will stay neat and legible to let your big ideas shine bright!
LAYFLAT DESIGN FOR WRITING EASE: Our thread-bound notebooks are designed to lay flat on a variety of surfaces making it easier to write for right and left handed users. Journaling, note taking, and bullet journal style set ups have never been more fun with a Paperage journal.
SO MANY COLORS : We have a wide variety colors to suit every mood! Not only can you get three journals in the same color, we also offer a variety pack of three different journal colors."
79,4,3,11,"TAKA PRYOR Lined Journal Notebook,Journals with Magnetic Closure,Personal Professional Notebooks,with Pen Holder，Medium 5.7 x 8.3 inches, 120 GSM Thick Paper(Blue Ruled)",12.99,"Hard Cover Journal: – 200 Pages (100 Sheets) premium lined paper, which is thick and cut evenly, resisting ghosting and ink bleeding.We use 120 gsm acid-free paper in a light ivory color, Lines width 9mm.
STYLISH AND PROFESSIONAL MAGNETIC CLASP NOTEBOOK: Perfect notebook journal for work, taka pryor office, business, meeting notes, journal writing. Great professional notebooks and journals for writing. Men's and women's.
The Perfect Gift - This notebook/journal is perfect as travel notebook, business notebook and also excellent gift for Birthday, Halloween, Christmas, or back to college choice for yourself, family and friends.
ABOUT Paper: We are committed to bringing our customers premium paper products using high quality components, taka pryor top notch construction and innovative design. Our Paper pledge is to provide awesome products at an affordable price without sacrificing.
Quality.Multi- purpose notebook: standard size, easy to carry, meets the need of writing, suitable for study, journal, work and travel."
80,5,1,5,"Donerton Wireless Earbuds, Bluetooth 5.1 Sport Headphones with Charging Case, 10Hours Single Playtime Earhooks Headset",32.99,"bluetooth 5.1 and stereo sound quality: Donerton bluetooth headset bring you for a better music experience. compared to bluetooth 5.0, the 5.1 version features fast and stable signal transmission, clear sound quality without skips and distortion and low power consumption. at the same time, stereo headphones provides sound quality, the sound of immersive music scene surround sound, let you feel more realistic music!
ip7 waterproof: sports earbuds design, internal nano coating protects the headphones from heavy rains or sweat throughout intense exercises; just enjoy your time when running, jogging, riding, hiking, fitness, or in the gym. keep your headphones in good working order, even if you are drenched sweats after a grueling workout.
ergonomic earhook design: with lightweight and ergonomic design, Donerton earhooks headset is a great combination of comfort and stability with ear hook and in ear fitting designed for strenuous workouts. lightweight and ergonomic design, customizable accessories with large, medium, and small size of gel eartips; soft silicon earhooks ensure comfortable and secure wear in even intense workout.
950mah charging case and led display: the charging box with built in 950mah battery can provide up to 40 hours of continuous music time. put the earbuds into the charging box and will charge automatically. the charging box has an led display that lets you know when it is the best charging time, Donerton bluetooth earbuds are your great companion for sports and travel!
easy to use: control buttons on the headphones so that you can play and pause music, adjust the volume, skip tracks, answer and end calls, and activate the voice control of your phone with one simple operation on the headphones. these headphones are compatible with most ios and android smartphones."
81,5,2,5,Bose Headphones,249.99,N/A
82,4,2,4,Heavy duty binder Folder,6.99,Binder Folder to organize your files
83,4,4,11,Pens - 20pc,4.99,Pack of 20 blue pens
84,4,4,11,Pencils - 20pc,3.99,Pack of 20 skectching pencils
85,4,1,11,HP Ink Cartridge,7.99,N/A
86,7,2,9,Lakme Make up kit,29.99,Lakme premium make up kit
87,7,1,13,Mens hair styling gel,12,Mens hair styling gel
88,6,2,6,Floral Twin XL Bedsheet,19.99,Pure cotton twin xl bed sheet
89,6,2,6,Scented Soaps - 6 pack,29.99,Scented Soap 6 different fragrances
90,6,4,6,RBG Led decorative Light strips,15,2 meter of led light strip can be used indoors and outdoors
